global_key,source,job_id,job_url,title,company,company_link,location,country,posted_date,num_applicants,work_mode,employment_type,position,type,compensation,commitment,skills,category_primary,domain_l1,domain_l2,domain_l3,tax_confidence,scraped_at,master_built_at
https://www.jobsnepal.com/external-facilitator-for-renewed-fia-nepal-141370,jobsnepal,141370,https://www.jobsnepal.com/external-facilitator-for-renewed-fia-nepal-141370,External Facilitator for Renewed FIA Nepal,Fight Inequality Alliance,https://www.jobsnepal.com/employer/fight-inequality-alliance/477329,Kathmandu,Nepal,2026-02-20,,,Contract,,Contract,,,"Development Project, Expression of Interests, Tender Notice, Bid",Non-IT,Legal,Other,Other,0.42,2026-02-25 11:48:57.848341,2026-02-25T18:01:32
https://www.jobsnepal.com/driver-141371,jobsnepal,141371,https://www.jobsnepal.com/driver-141371,Driver,Swisscontact Swiss Foundation for Technical Cooperation,https://www.jobsnepal.com/employer/swisscontact-swiss-foundation-for-technical-cooperation/10168,Kathmandu,Nepal,2026-02-20,,,Full Time,,Full Time,,,"At least School Leaving Certificate. Minimum of three years’ work experience in a similar position, preferably with donors and INGOs. To Apply: Please visit our website https://www.swisscontact.org/en/countries/nepal/jobs for a detailed job description and submit a job application form Driver through an online portal. The deadline for submission of the application is March 5, 2026. Swisscontact will not entertain any phone enquiries or other such solicitations for these positions. Only shortlisted candidates will be contacted for the selection process. Swisscontact reserves the right to reject any and all applications. Swisscontact is an equal opportunity employer. Women and applicants from disadvantaged groups are encouraged to apply. Save to favorite Refer to a friend",Non-IT,HR,General,Other,0.42,2026-02-25 11:48:56.617995,2026-02-25T18:01:32
https://www.jobsnepal.com/call-for-proposals-implementing-partner-for-inclusive-community-development-project-icdp-141372,jobsnepal,141372,https://www.jobsnepal.com/call-for-proposals-implementing-partner-for-inclusive-community-development-project-icdp-141372,Call for Proposals: Implementing Partner for Inclusive Community Development Project (ICDP),Miral Welfare Foundation,https://www.jobsnepal.com/employer/miral-welfare-foundation/477314,,Nepal,2026-02-20,,,,,,,,NGO/INGO/Social work,Non-IT,Non-IT-Other,Other,Other,0.35,2026-02-25 11:48:55.658375,2026-02-25T18:01:32
https://www.jobsnepal.com/notice-for-invitation-of-expression-of-interest-eoi-141373,jobsnepal,141373,https://www.jobsnepal.com/notice-for-invitation-of-expression-of-interest-eoi-141373,NOTICE FOR INVITATION OF EXPRESSION OF INTEREST (EOI),Bagmati Welfare Society Nepal(BWSN),https://www.jobsnepal.com/employer/bagmati-welfare-society-nepalbwsn/7893,Sarlahi,Nepal,2026-02-20,,,Contract,,Contract,,,"Development Project, Expression of Interests, Tender Notice, Bid",Non-IT,Backend,Node,Express,0.56,2026-02-25 11:48:54.329334,2026-02-25T18:01:32
https://www.jobsnepal.com/terms-of-reference-for-research-consultant-141374,jobsnepal,141374,https://www.jobsnepal.com/terms-of-reference-for-research-consultant-141374,Terms of Reference for Research Consultant,KOSHISH,https://www.jobsnepal.com/employer/koshish/411460,Lalitpur,Nepal,2026-02-22,,,Contract,,Contract,,,"Development Project, Research, Expression of Interests, Tender Notice, Bid",Non-IT,Legal,Other,Other,0.42,2026-02-25 11:48:53.353458,2026-02-25T18:01:32
https://www.jobsnepal.com/various-positions-141375,jobsnepal,141375,https://www.jobsnepal.com/various-positions-141375,Various Positions,The Story Kitchen,https://www.jobsnepal.com/employer/the-story-kitchen/8724,Lalitpur,Nepal,2026-02-22,,,Contract,,Contract,,,"Please check vacancy details, Development Project, Finance & Administration, Development studies, Management, NGO/INGO/Social work, Mass Communication/Journalism",Non-IT,Operations,Admin,Other,0.54,2026-02-25 11:48:51.959196,2026-02-25T18:01:32
https://www.jobsnepal.com/invitation-for-bids-141376,jobsnepal,141376,https://www.jobsnepal.com/invitation-for-bids-141376,INVITATION FOR BIDS,Tukee Foundation,https://www.jobsnepal.com/employer/tukee-foundation/391977,Kathmandu,Nepal,2026-02-22,,Remote,Contract,,Contract,,,"Development Project, Expression of Interests, Tender Notice, Bid",Non-IT,Legal,Other,Other,0.42,2026-02-25 11:48:50.496133,2026-02-25T18:01:32
https://www.jobsnepal.com/receptionist-front-desk-officer-dental-hygienist-141377,jobsnepal,141377,https://www.jobsnepal.com/receptionist-front-desk-officer-dental-hygienist-141377,Receptionist/ front desk officer/ dental hygienist,Smile Station Dental clinic,https://www.jobsnepal.com/employer/smile-station-dental-clinic/417928,Kathmandu,Nepal,2026-02-22,,,Full Time,"Mid Level, Junior Level",Full Time,As per organization rules - 19000 to 25000 / Month,,"Advanced degree in relevant discipline, 10+2 in management, 10+2 in Business Management, Health Medicine",Non-IT,Hospitality,Other,Other,0.54,2026-02-25 11:48:49.471664,2026-02-25T18:01:32
https://www.jobsnepal.com/annual-procurement-notice-141378,jobsnepal,141378,https://www.jobsnepal.com/annual-procurement-notice-141378,Annual Procurement Notice,Public Awareness Campaign Nepal ( PAC Nepal),https://www.jobsnepal.com/employer/public-awareness-campaign-nepal-pac-nepal/409858,,Nepal,2026-02-22,,,,,,,,,Non-IT,Operations,Procurement,Other,0.42,2026-02-25 11:48:48.421780,2026-02-25T18:01:32
https://www.jobsnepal.com/narajavana-bma-samabnathha-parasatava-aahavanaka-sacana-141379,jobsnepal,141379,https://www.jobsnepal.com/narajavana-bma-samabnathha-parasatava-aahavanaka-sacana-141379,निर्जीवन बीमा सम्बन्धी प्रस्ताव आह्वानको सूचना,Suncity apartment welfare society,https://www.jobsnepal.com/employer/suncity-apartment-welfare-society/457771,Kathmandu,Nepal,2026-02-23,,,Contract,,Contract,,,"Insurance, Expression of Interests, Tender Notice, Bid",Non-IT,Legal,Other,Other,0.42,2026-02-25 11:48:47.121672,2026-02-25T18:01:32
https://www.jobsnepal.com/project-coordinator-141380,jobsnepal,141380,https://www.jobsnepal.com/project-coordinator-141380,Project Coordinator,FOCUS Nepal,https://www.jobsnepal.com/employer/focus-nepal/8225,Dhading,Nepal,2026-02-23,,,Contract,,Contract,,,"Please check vacancy details, Public Health, Social Science, Development Project, Nutrition",Non-IT,Healthcare,General,Other,0.42,2026-02-25 11:48:46.195018,2026-02-25T18:01:32
https://www.jobsnepal.com/field-officer-141381,jobsnepal,141381,https://www.jobsnepal.com/field-officer-141381,Field Officer,Green Nova Consulting Pvt Ltd,https://www.jobsnepal.com/employer/green-nova-consulting-pvt-ltd/477407,Lalitpur,Nepal,2026-02-23,,Remote,Contract,,Contract,,"Soon as Possible Start Date: Soon as Possible 1. Background Novelty Consulting Pvt. Ltd. is engaged in the development, implementation, and management of climate finance and carbon market projects across Nepal. The company works on high-integrity carbon programs including improved cookstoves, water purification systems, biochar carbon removal, biogas installations, agroforestry, and other nature-based and engineered climate solutions. To strengthen field-level implementation, quality assurance, and community coordination, Novelty Consulting Pvt. Ltd. seeks to recruit a dedicated and results-oriented Field Officer. 2. Objective of the Position The Field Officer will support on-the-ground implementation of carbon and climate-related projects, ensuring timely delivery, quality control, community engagement, monitoring, data collection (including DMRV systems), and compliance with technical and environmental standards. The position plays a critical role in maintaining project integrity, field coordination, and ensuring alignment with national policies and international carbon standards (e.g., Gold Standard, Puro.Earth, VCS, Article 6 readiness). 3. Scope of Work and Key Responsibilities A. Project Implementation Support Support installation and deployment of project technologies (e.g., ICS, water purification systems, biogas units, biochar kilns, agroforestry plantations). Coordinate with local contractors, suppliers, CFUGs, municipalities, and beneficiaries. Ensure installations meet technical and quality standards. Assist in pre-installation site assessments and beneficiary selection processes. B. Monitoring, Reporting, and Verification (MRV) Conduct field monitoring and data collection as per project monitoring plans. Support Digital Monitoring, Reporting and Verification (DMRV) systems including use of mobile-based data collection tools (e.g., Kobo, ODK). Maintain accurate records of installations, usage, and beneficiary data. Assist in baseline surveys, endline surveys, and periodic verification exercises. Support third-party validation and verification audits. C. Community Engagement and Capacity Building Facilitate community meetings, awareness sessions, and training programs. Support GESI (Gender Equality and Social Inclusion) integration in field activities. Address beneficiary concerns and provide technical guidance where needed. Coordinate with local governments and community institutions. D. Logistics and Coordination Support logistics planning for equipment delivery and installation. Ensure safe storage and handling of materials and equipment. Maintain inventory records at site level. Provide regular updates to the Project Manager on field progress. E. Documentation and Reporting Prepare weekly and monthly field reports. Document lessons learned, success stories, and field challenges. Capture geo-tagged photos and relevant documentation for compliance and communication purposes. 4. Deliverables Monthly progress reports. Verified installation records and beneficiary database updates. Monitoring data submission as per project requirements. Field visit documentation and compliance checklists. Support documentation for carbon standard registration and verification. 5. Required Qualifications and Experience Education Bachelor’s degree in Environmental Science, Forestry, Agriculture, Engineering, Development Studies, or related field. Diploma holders with strong relevant field experience may be considered. Experience Minimum 2–3 years of field-level experience in climate, energy, forestry, rural development, or related projects. Experience in carbon finance projects (ICS, biogas, biochar, agroforestry, water) is highly desirable. Familiarity with MRV systems and digital data collection tools is an advantage. Skills and Competencies Strong community mobilization and facilitation skills. Basic technical understanding of renewable energy or environmental technologies. Ability to travel extensively to remote locations. Good reporting and documentation skills. Proficiency in Nepali and working knowledge of English. Strong ethical standards and integrity. 6. Performance Criteria Timely and quality completion of installations. Accuracy and completeness of monitoring data. Effective community engagement and stakeholder coordination. Compliance with project technical and safeguard standards. Adherence to reporting timelines. 7. Institutional Arrangements The Field Officer will report directly to the Project Manager and coordinate closely with technical teams, carbon registry experts, and local partners. Regular supervision meetings will be conducted to ensure performance tracking and guidance. 8. Ethical and Safeguard Compliance The Field Officer must: Comply with environmental and social safeguard requirements. Ensure beneficiary protection and informed consent. Adhere to anti-corruption and conflict-of-interest policies. Maintain confidentiality of project data. 9. Remuneration Remuneration will be commensurate with qualifications and experience, in accordance with the salary scale of Novelty Consulting Pvt. Ltd. Candidate can drop application with CV on Email: greennovaconsulting2026@gmail.com Only short-listed candidates will be invited for test interview. Save to favorite Refer to a friend","Bachelor's degree in a related field, Agriculture, Development Project, Development studies, Management, Forestry",Non-IT,Operations,Admin,Other,0.42,2026-02-25 11:48:45.057141,2026-02-25T18:01:32
https://www.jobsnepal.com/rfp-for-web-based-advanced-financial-management-software-141382,jobsnepal,141382,https://www.jobsnepal.com/rfp-for-web-based-advanced-financial-management-software-141382,RFP for Web-based Advanced Financial Management Software,Heifer International Nepal,https://www.jobsnepal.com/employer/heifer-international-nepal/10029,Lalitpur,Nepal,2026-02-23,,,Contract,,Contract,,,"Development Project, Expression of Interests, Tender Notice, Bid",IT,Backend,Node,Express,0.56,2026-02-25 11:48:43.639284,2026-02-25T18:01:32
https://www.jobsnepal.com/tor-for-a-consultant-to-develop-the-farmers-market-school-fms-manual-for-dairy-farmers-and-facilitation-of-training-of-trainers-tot-141383,jobsnepal,141383,https://www.jobsnepal.com/tor-for-a-consultant-to-develop-the-farmers-market-school-fms-manual-for-dairy-farmers-and-facilitation-of-training-of-trainers-tot-141383,TOR for a consultant to Develop the Farmers Market School (FMS) Manual for Dairy Farmers and Facilitation of Training of Trainers (ToT),Heifer Project Nepal,https://www.jobsnepal.com/employer/heifer-project-nepal/11496,Lalitpur,Nepal,2026-02-23,,,Contract,,Contract,,,"Development Project, Expression of Interests, Tender Notice, Bid",Non-IT,Education,Other,Other,0.54,2026-02-25 11:48:42.554270,2026-02-25T18:01:32
https://www.jobsnepal.com/content-creator-141384,jobsnepal,141384,https://www.jobsnepal.com/content-creator-141384,Content Creator,VCorporation,https://www.jobsnepal.com/employer/vcorporation/477410,Kathmandu,Nepal,2026-02-23,,,,,,Rs. - 50000 to 70000 / Month,,Marketing,Non-IT,Marketing,General,Other,0.54,2026-02-25 11:48:41.250428,2026-02-25T18:01:32
https://www.jobsnepal.com/people-and-administration-officer-global-team-141385,jobsnepal,141385,https://www.jobsnepal.com/people-and-administration-officer-global-team-141385,People and Administration Officer (global team),UWS Nepal,https://www.jobsnepal.com/employer/uws-nepal/396893,Kathmandu,Nepal,2026-02-23,,Remote,Full Time,Mid Level,Full Time,,,Human Resources,Non-IT,Operations,Admin,Other,0.66,2026-02-25 11:48:40.353098,2026-02-25T18:01:32
https://www.jobsnepal.com/clinic-incharge-141386,jobsnepal,141386,https://www.jobsnepal.com/clinic-incharge-141386,CLINIC INCHARGE,Samaj Dental,https://www.jobsnepal.com/employer/samaj-dental/441716,Kathmandu,Nepal,2026-02-23,,,Full Time,Junior Level,Full Time,,,"Graduate (Bachelors), Bachelor's in Management, Administrative / Management",Non-IT,Operations,Admin,Other,0.42,2026-02-25 11:48:39.038505,2026-02-25T18:01:32
https://www.jobsnepal.com/tor-for-technical-support-service-on-forest-biomass-based-biofertilizer-production-unit-establishment-and-operation-141387,jobsnepal,141387,https://www.jobsnepal.com/tor-for-technical-support-service-on-forest-biomass-based-biofertilizer-production-unit-establishment-and-operation-141387,TOR for TECHNICAL SUPPORT SERVICE ON FOREST BIOMASS-BASED BIOFERTILIZER PRODUCTION UNIT ESTABLISHMENT AND OPERATION,Heifer International Nepal,https://www.jobsnepal.com/employer/heifer-international-nepal/10029,Lalitpur,Nepal,2026-02-23,,Remote,Contract,,Contract,,,"Development Project, Expression of Interests, Tender Notice, Bid",IT,Backend,Node,Express,0.64,2026-02-25 11:48:37.767353,2026-02-25T18:01:32
https://www.jobsnepal.com/rfq-for-it-equipment-laptop-copier-141388,jobsnepal,141388,https://www.jobsnepal.com/rfq-for-it-equipment-laptop-copier-141388,RFQ for IT equipment (Laptop & Copier),DanChurchAid (DCA),https://www.jobsnepal.com/employer/danchurchaid-dca/8067,Lalitpur,Nepal,2026-02-23,,,Contract,,Contract,,,"Development Project, Expression of Interests, Tender Notice, Bid",Non-IT,Legal,Other,Other,0.42,2026-02-25 11:48:36.354750,2026-02-25T18:01:32
https://www.jobsnepal.com/partnership-manager-141389,jobsnepal,141389,https://www.jobsnepal.com/partnership-manager-141389,Partnership manager,Arukubossystems LLC,https://www.jobsnepal.com/employer/arukubossystems-llc/476922,,Nepal,2026-02-23,,Remote,Full Time,Entry-level,Full Time,Above Rs. 55000 / Month,,"Bachelor's degree completed, Client Servicing Manager",Non-IT,Management,General,Other,0.42,2026-02-25 11:48:35.301242,2026-02-25T18:01:32
https://www.jobsnepal.com/shalbnatha-katashana-aahavanaka-sacana-141390,jobsnepal,141390,https://www.jobsnepal.com/shalbnatha-katashana-aahavanaka-sacana-141390,शिलबन्दी कोटेशन आह्वानको सूचना,Human Resources Center,https://www.jobsnepal.com/employer/human-resources-center/432927,Bajura,Nepal,2026-02-23,,,Contract,,Contract,,,"Development Project, Expression of Interests, Tender Notice, Bid",Non-IT,Legal,Other,Other,0.42,2026-02-25 11:48:34.261264,2026-02-25T18:01:32
https://www.jobsnepal.com/admin-and-finance-associate-141391,jobsnepal,141391,https://www.jobsnepal.com/admin-and-finance-associate-141391,Admin and Finance Associate,Suryodaya Club,https://www.jobsnepal.com/employer/suryodaya-club/454119,Syangja,Nepal,2026-02-24,,Remote,Contract,,Contract,,,"Bachelor's in Management, Administrative / Management, Development Project, Finance & Administration",Non-IT,Operations,Admin,Other,0.54,2026-02-25 11:48:33.069328,2026-02-25T18:01:32
https://www.jobsnepal.com/program-manager-141392,jobsnepal,141392,https://www.jobsnepal.com/program-manager-141392,Program Manager,Suryodaya Club,https://www.jobsnepal.com/employer/suryodaya-club/454119,Syangja,Nepal,2026-02-24,,Remote,Contract,,Contract,,,"Post Graduate / Masters in related field., Administrative / Management, Education, Development Project, NGO/INGO/Social work",Non-IT,Operations,Admin,Other,0.42,2026-02-25 11:48:31.761858,2026-02-25T18:01:32
https://www.jobsnepal.com/business-development-officer-141393,jobsnepal,141393,https://www.jobsnepal.com/business-development-officer-141393,Business Development Officer,Total Management Services Pvt. Ltd.,https://www.jobsnepal.com/employer/total-management-services-pvt-ltd/461563,Kathmandu,Nepal,2026-02-24,,,Full Time,Mid Level,Full Time,Based on experience,,"Bachelor's degree completed, Development Project",Non-IT,Sales,General,Other,0.54,2026-02-25 11:48:30.308947,2026-02-25T18:01:32
https://www.jobsnepal.com/notice-for-motorbike-auction-141394,jobsnepal,141394,https://www.jobsnepal.com/notice-for-motorbike-auction-141394,Notice for Motorbike Auction,Heifer Project Nepal,https://www.jobsnepal.com/employer/heifer-project-nepal/11496,Lalitpur,Nepal,2026-02-24,,,Contract,,Contract,,,"Development Project, Expression of Interests, Tender Notice, Bid",Non-IT,Legal,Other,Other,0.42,2026-02-25 11:48:29.365374,2026-02-25T18:01:32
https://www.jobsnepal.com/osp-coordinator-141395,jobsnepal,141395,https://www.jobsnepal.com/osp-coordinator-141395,OSP Coordinator,HHRD USA Nepal,https://www.jobsnepal.com/employer/hhrd-usa-nepal/439379,Kathmandu,Nepal,2026-02-24,,,Contract,Mid Level,Contract,Based on experience,,"B. A. (Bachelors in Art), Bachelor's degree in Development Studies, Social Science, Business Management, 10+2 in management, Bachelor's Degree in Humanities/Social Work/Education, Development / INGO, NGO/INGO/Social work",Non-IT,Legal,Other,Other,0.42,2026-02-25 11:48:28.009108,2026-02-25T18:01:32
https://www.jobsnepal.com/japanese-language-coordinator-141396,jobsnepal,141396,https://www.jobsnepal.com/japanese-language-coordinator-141396,Japanese Language Coordinator,Shine Education Services Pvt. Ltd.,https://www.jobsnepal.com/employer/shine-education-services-pvt-ltd/457578,Kathmandu,Nepal,2026-02-24,,,Full Time,,Full Time,,,"Bachelor's degree in a related field, Education, Teachers, Instructor",Non-IT,Education,Other,Other,0.54,2026-02-25 11:48:26.438322,2026-02-25T18:01:32
https://www.jobsnepal.com/shalbnatha-katashana-aahavanaka-sacana-141397,jobsnepal,141397,https://www.jobsnepal.com/shalbnatha-katashana-aahavanaka-sacana-141397,शिलबन्दी कोटेशन आह्वानको सूचना,National Environment and Equity Development Society (NEEDS Nepal),https://www.jobsnepal.com/employer/national-environment-and-equity-development-society-needs-nepal/7489,Kanchanpur,Nepal,2026-02-24,,,Contract,,Contract,,,"Development Project, Expression of Interests, Tender Notice, Bid",Non-IT,Operations,Procurement,Other,0.54,2026-02-25 11:48:25.512570,2026-02-25T18:01:32
https://www.jobsnepal.com/technical-coordinator-141398,jobsnepal,141398,https://www.jobsnepal.com/technical-coordinator-141398,Technical Coordinator,Renewable World,https://www.jobsnepal.com/employer/renewable-world/8138,Kathmandu,Nepal,2026-02-24,,,Full Time,,Full Time,,,"Bachelors in Engineering, Masters in Engineering, Technical, Development Project, Engineering",Non-IT,Finance,Tax,,0.54,2026-02-25 11:48:24.448171,2026-02-25T18:01:32
