global_key,source,job_id,job_url,title,company,company_link,location,country,posted_date,num_applicants,work_mode,employment_type,position,type,compensation,commitment,skills,category_primary,domain_l1,domain_l2,domain_l3,tax_confidence,scraped_at,master_built_at
https://www.jobsnepal.com/request-for-quotation-rfq-141291,jobsnepal,141291,https://www.jobsnepal.com/request-for-quotation-rfq-141291,REQUEST FOR QUOTATION (RFQ),Integrated Rural Development Society,https://www.jobsnepal.com/employer/integrated-rural-development-society/421985,Mahottari,,2026-02-11,,,Contract,,Contract,,,"Development Project, Expression of Interests, Tender Notice, Bid",Non-IT,Legal,Other,Other,0.42,,2026-02-25T18:01:32
https://www.jobsnepal.com/call-for-expression-of-interest-eoi-for-partnership-141292,jobsnepal,141292,https://www.jobsnepal.com/call-for-expression-of-interest-eoi-for-partnership-141292,Call for Expression of Interest (EoI) for Partnership,World Neighbors,https://www.jobsnepal.com/employer/world-neighbors/477043,Sindhuli,,2026-02-11,,Remote,Contract,,Contract,,,"Development Project, Expression of Interests, Tender Notice, Bid",Non-IT,Legal,Other,Other,0.42,,2026-02-25T18:01:32
https://www.jobsnepal.com/programme-officer-141293,jobsnepal,141293,https://www.jobsnepal.com/programme-officer-141293,Programme Officer,Atoot,https://www.jobsnepal.com/employer/atoot/442873,Kapilvastu,,2026-02-11,,,Contract,,Contract,,,"Please check vacancy details, Education, Development Project, NGO/INGO/Social work",Non-IT,Operations,Admin,Other,0.42,,2026-02-25T18:01:32
https://www.jobsnepal.com/terms-of-reference-to-conduct-a-comprehensive-study-on-water-governance-and-sustainability-of-water-supply-schemes-in-the-hilly-and-terai-region-of-nepal-141294,jobsnepal,141294,https://www.jobsnepal.com/terms-of-reference-to-conduct-a-comprehensive-study-on-water-governance-and-sustainability-of-water-supply-schemes-in-the-hilly-and-terai-region-of-nepal-141294,Terms of Reference To Conduct a Comprehensive Study on Water Governance and Sustainability of Water Supply Schemes in the Hilly and Terai Region of Nepal,Welthungerhilfe,https://www.jobsnepal.com/employer/welthungerhilfe/403116,Lalitpur,,2026-02-11,,,Contract,,Contract,,,"Development Project, Expression of Interests, Tender Notice, Bid",Non-IT,Legal,Other,Other,0.42,,2026-02-25T18:01:32
https://www.jobsnepal.com/term-of-reference-for-design-development-and-deployment-of-national-dairy-database-system-141295,jobsnepal,141295,https://www.jobsnepal.com/term-of-reference-for-design-development-and-deployment-of-national-dairy-database-system-141295,"Term of Reference For Design, Development and Deployment of National Dairy Database System",Heifer Project Nepal,https://www.jobsnepal.com/employer/heifer-project-nepal/11496,,,2026-02-12,,,Contract,,Contract,,12 months,"Information Technology, Development Project, Software Development",IT,IT-Other,Other,Other,0.75,,2026-02-25T18:01:32
https://www.jobsnepal.com/consultant-for-developing-motivational-session-guideline-for-youth-who-are-suspected-of-or-involved-in-substance-abuse-in-nijgadh-bara-141296,jobsnepal,141296,https://www.jobsnepal.com/consultant-for-developing-motivational-session-guideline-for-youth-who-are-suspected-of-or-involved-in-substance-abuse-in-nijgadh-bara-141296,Consultant for Developing Motivational Session Guideline for youth who are suspected of or involved in substance abuse in Nijgadh Bara,Protection Nepal,https://www.jobsnepal.com/employer/protection-nepal/425771,Nijgadh,,2026-02-12,,,Contract,,Contract,,"Short-term consultancy (expected 4–5 weeks) Required Qualifications & Experience: Master's degree in psychology, counselling, social work, public health, or related field Minimum 3 years of experience in psychosocial counselling, adolescent/youth mental health, or substance abuse programs Proven experience in developing counselling manuals or guidelines as well as providing training in Psychosocial counselling, adolescent/youth mental health, substance abuse and harmreduction programs Excellent writing skills in English; proficiency in Nepali Indepth knowledge of adolescent mental health, substance use, and harm reduction approaches How to Apply: Interested candidates are requested to submit: Updated CV Cover letter highlighting relevant experience Brief Financial proposal by mentioning tentative cost for development of the Y-PSG guideline, if selected, final cost will be finalized after negotiation between two parties If applied through the organisation/company, please provide the organizational legal document too (registration, VAT/PAN registration and latest tax clearance certificate) Sample of previous counselling or guideline development work (if available) Copy of higher academic transcripts and relevant training certificates Applications should be sent to: vacancy.pnbara@gmail.com Contact Person: Hiralal Chaudhary Executive Director Contact no: 053-590031/ 9845038050 Email: pnbaradirector@gmail.com Website: www.pnbara.org.np Deadline: 18 February 2026 Save to favorite Refer to a friend","Please check details, Development Project, Expression of Interests, Tender Notice, Bid",Non-IT,Finance,Tax,Other,0.42,,2026-02-25T18:01:32
https://www.jobsnepal.com/various-positions-141297,jobsnepal,141297,https://www.jobsnepal.com/various-positions-141297,Various Positions,Rural Oriented Youth Movement Nepal (ROYM Nepal),https://www.jobsnepal.com/employer/rural-oriented-youth-movement-nepal-roym-nepal/439152,Kathmandu,,2026-02-12,,,Contract,,Contract,,"Regular (Fixed Term) Reporting To: Senior Program Coordinator Purpose of the Position: The Communication Officer plays a vital role in shaping and sharing the organization’s story with diverse audiences. This position is responsible for developing and implementing communication strategies that effectively promote the NGO’s mission, programs, and impact. The Communication Officer ensures that internal and external communications are clear, consistent, and compelling helping to build the organization’s reputation, engage stakeholders, and support fundraising and advocacy efforts. Specific Duties and Responsibilities: Develop and implement a comprehensive communication strategy aligned with the organization’s goals and donor requirements. Identify key messages, target audiences, and appropriate communication channels to maximize outreach and engagement. Coordinate with program teams to ensure communication plans reflect program achievements and priorities. Contribute to the strategic planning and preparation of annual organizational and donor reports by aligning communication deliverables with reporting needs. Video development, editing and dissemination. Capacitate the team for pictures, video clips collection, visual reporting and dissemination. Develop the necessary IEC materials, case studies, success stories of right holders, outputs, results, outcomes and impacts of organization’s interventions. Any other responsibility as required and assigned. Write, edit, and produce engaging content for various platforms, including website, social media, newsletters, reports, press releases, brochures, and case studies. Assist in developing Information, Education, and Communication (IEC) materials tailored to project needs, ensuring content is clear, culturally relevant, and accessible. Support the creation of impact-level success stories and coordinate with field teams to gather authentic narratives that highlight program achievements. Travel to project sites alongside program teams, as per the guidance of supervisors, to collect success stories, testimonials, photos, and videos that effectively showcase the organization’s work and impact. Document quality photos and videos of program activities, beneficiaries, and events for use in donor reports, success stories, and promotional materials. Prepare and report compelling success stories and case studies to donors as part of project updates and donor reporting requirements, ensuring stories clearly demonstrate the impact and value of donor support. Collaborate on the production of videos and multimedia content that effectively communicate the organization’s work and influence. Ensure all content reflects the organization’s brand voice, values, and communication guidelines. Manage and update the organization’s website, ensuring information is current, accurate, and visually appealing. Oversee social media channels by creating regular posts, responding to comments, and monitoring audience engagement and analytics. Explore and recommend new digital tools and platforms to expand the organization’s online reach. Build and maintain relationships with journalists, media outlets, and influencers to secure coverage of the organization’s work. Prepare press releases, media kits, and arrange interviews or events that increase public awareness. Monitor media coverage and provide regular reports on communication impact. Requirements: Education and Experiences The candidates should have at least Bachelor’s Degree in mass communication, media study, journalism, or related fields with at least three years of related work experience in similar field. Essential Skills Strong writing and editing skills: Produce clear, concise, and compelling content via written, audio and visual means for various audiences and platforms. Strategic thinking: Develop creative and effective communication plans. Interpersonal and public relations: Build and maintain positive relationships with media, stakeholders, and the public. Digital proficiency: Expertise in managing social media, digital content, and communication analytics. Proficient in handling different related software or applications of communication materials. Time management: Fulfill communication and development expectation of multiple projects and deadlines effectively. Analytical skills: Track and interpret data from campaigns and programs. 2. Position: Social Mobilizer cum Junior Technical Assistant (SM cum JTA) Organization: Rural Oriented Youth Movement-Nepal (ROYM-Nepal) Location: Mahottari District Madesh province, Nepal Duration: One Year Reporting To: District Project Coordinator (DPC) Position Description: Social Mobilizer cum Junior Technical Assistant (SM cum JTA) oversee the technical aspect of all project activities that are directly linked to supporting agricultural and livelihood aspects of community. SM cum JTA works in close coordination with district-based District Project Officers and Project Coordinator other staffs in achieving the objectives of the project. They are mainly responsible for project management, program planning, implementation and quality management, documentation, stakeholder communications and coordination with local stakeholders of program district. SM cum JTA reports to the District Project Officer and Coordinator. This position will be for 1 year (including 3-month probation period) with possibility of extension having annual performance review. Duties and Responsibilities Managing and providing necessary trainings to the farmers groups to improve their farming activities. Managing work and relationships, and motivating farmers in the program areas. Coordinate with Agri-Business entrepreneurs to enhance the market linkage of the local producers. Providing technical guidance to farmers on growing, monitoring, and pest management of selected crops for targeted output achievement. Recording and sharing the good practices of farming practices in the community and manage record-keeping system. Take lead role, guide and support Social Mobilizers for community orientation and take sessions on technical aspects of agricultural, livestock and allied activities. Provide advice to end-user farmers on agricultural practices to optimize quality, yield, and income. Coordinate local women groups and community people to install and operate irrigation system (with hydro-powered pumps), fertilizer application, growing periods, seed types, planting preparations, weeding & pest control, and prevent diseases, for high-value crops, based on local soil conditions. Provide feedback to the team to develop agriculture intervention programs in same or other locations. Making daily visits and monitoring agricultural and livestock farms. Qualification & Experiences: At least Technical Assistant with minimum of 2 years of working experience in agricultural and livelihood improvement activities in Nepal. Should have sound knowledge of the application of fertilizers, insecticides, and livestock disease control. Should have good communication and interpersonal skills to deliver agriculture training in the community. Hands-on experience working in farming, production planning, and training farmers. Ability to motivate and manage farmers. Knowledge and experience of agri-business practices with smallholder farmers are preferred. Fluence in spiking and understanding on Maithali language. 3. Position: Program Intern Organization: Rural Oriented Youth Movement-Nepal (ROYM-Nepal) Location: Tilathi Koiladi Rural Municipality, Saptari, Nepal Duration: 3 months Reporting To: District Project Coordinator (DPC) Purpose of the Position The Intern will assist ROYM-Nepal in managing internal and external programmatic activities, including planning, data entry, documentation, and event report preparation. The role is designed to build the intern’s skills while contributing meaningfully to the organization’s mission. Major Responsibilities: Support data management and report writing of the event as assigned by DPC of the project. Support the documentation of programs, events, workshops, and campaigns (photos, short reports, captions, success stories) Support the finance officer for documentation; filing, bill attachment, checking out the attendance sheet etc. Should carry out field visits as directed by the DPC according to the program. Should carry out banking activities; check deposit, withdraw balance sheet from nearby banks. Should assist DPC and finance officer in administrative works as per situation. Should have to perform any of the official works as guided by DPC and team. Learning Opportunities Through this internship, the intern will gain: Hands-on experience in documentation of the program, finance and report preparation. Exposure to youth-led and community-based programs Mentorship and feedback from experienced team members Qualification: Must have Nepalese citizen with Citizenship Card of the GON. Must have +2 or higher secondary degree/ bachelors’ degree will be given priority and proficient in English language both writing and reading. Should know the basic financial calculations; TDS, E-TDS etc. Must be of age 18-25 years. Have eager to learn more. Must respect his/her roles and responsibilities, follow ROYM-Nepal’s policies, values, and code of conduct Must know and able to speak the local language of Tilathi Koiladi Rural Municipality, Saptari. Applying Procedures: Qualified candidates may send cover letter detailing their experience and motivation for the current position with an updated CV to nepalroym@gmail.com by 18th of February 2026. The application without cover letter and CV will not be considered for the position. Please write the name of Position you are applying for in the subject of email. Women and candidates from marginalized groups and respective Rural Municipality are encouraged to apply. Only the shortlisted candidates will be contacted and advance to written test and/or interview. No telephone calls will be entertained. Save to favorite Refer to a friend","Produce clear, concise, and compelling content via written, audio and visual means for various audiences and platforms. Strategic thinking: Develop creative and effective communication plans. Interpersonal and public relations: Build and maintain positive relationships with media, stakeholders, and the public. Digital proficiency: Expertise in managing social media, digital content, and communication analytics. Proficient in handling different related software or applications of communication materials. Time management: Fulfill communication and development expectation of multiple projects and deadlines effectively. Analytical skills: Track and interpret data from campaigns and programs. 2. Position: Social Mobilizer cum Junior Technical Assistant (SM cum JTA) Organization: Rural Oriented Youth Movement-Nepal (ROYM-Nepal) Location: Mahottari District Madesh province, Nepal Duration: One Year Reporting To: District Project Coordinator (DPC) Position Description: Social Mobilizer cum Junior Technical Assistant (SM cum JTA) oversee the technical aspect of all project activities that are directly linked to supporting agricultural and livelihood aspects of community. SM cum JTA works in close coordination with district-based District Project Officers and Project Coordinator other staffs in achieving the objectives of the project. They are mainly responsible for project management, program planning, implementation and quality management, documentation, stakeholder communications and coordination with local stakeholders of program district. SM cum JTA reports to the District Project Officer and Coordinator. This position will be for 1 year (including 3-month probation period) with possibility of extension having annual performance review. Duties and Responsibilities Managing and providing necessary trainings to the farmers groups to improve their farming activities. Managing work and relationships, and motivating farmers in the program areas. Coordinate with Agri-Business entrepreneurs to enhance the market linkage of the local producers. Providing technical guidance to farmers on growing, monitoring, and pest management of selected crops for targeted output achievement. Recording and sharing the good practices of farming practices in the community and manage record-keeping system. Take lead role, guide and support Social Mobilizers for community orientation and take sessions on technical aspects of agricultural, livestock and allied activities. Provide advice to end-user farmers on agricultural practices to optimize quality, yield, and income. Coordinate local women groups and community people to install and operate irrigation system (with hydro-powered pumps), fertilizer application, growing periods, seed types, planting preparations, weeding & pest control, and prevent diseases, for high-value crops, based on local soil conditions. Provide feedback to the team to develop agriculture intervention programs in same or other locations. Making daily visits and monitoring agricultural and livestock farms. Qualification & Experiences: At least Technical Assistant with minimum of 2 years of working experience in agricultural and livelihood improvement activities in Nepal. Should have sound knowledge of the application of fertilizers, insecticides, and livestock disease control. Should have good communication and interpersonal skills to deliver agriculture training in the community. Hands-on experience working in farming, production planning, and training farmers. Ability to motivate and manage farmers. Knowledge and experience of agri-business practices with smallholder farmers are preferred. Fluence in spiking and understanding on Maithali language. 3. Position: Program Intern Organization: Rural Oriented Youth Movement-Nepal (ROYM-Nepal) Location: Tilathi Koiladi Rural Municipality, Saptari, Nepal Duration: 3 months Reporting To: District Project Coordinator (DPC) Purpose of the Position The Intern will assist ROYM-Nepal in managing internal and external programmatic activities, including planning, data entry, documentation, and event report preparation. The role is designed to build the intern’s skills while contributing meaningfully to the organization’s mission. Major Responsibilities: Support data management and report writing of the event as assigned by DPC of the project. Support the documentation of programs, events, workshops, and campaigns (photos, short reports, captions, success stories) Support the finance officer for documentation; filing, bill attachment, checking out the attendance sheet etc. Should carry out field visits as directed by the DPC according to the program. Should carry out banking activities; check deposit, withdraw balance sheet from nearby banks. Should assist DPC and finance officer in administrative works as per situation. Should have to perform any of the official works as guided by DPC and team. Learning Opportunities Through this internship, the intern will gain: Hands-on experience in documentation of the program, finance and report preparation. Exposure to youth-led and community-based programs Mentorship and feedback from experienced team members Qualification: Must have Nepalese citizen with Citizenship Card of the GON. Must have +2 or higher secondary degree/ bachelors’ degree will be given priority and proficient in English language both writing and reading. Should know the basic financial calculations; TDS, E-TDS etc. Must be of age 18-25 years. Have eager to learn more. Must respect his/her roles and responsibilities, follow ROYM-Nepal’s policies, values, and code of conduct Must know and able to speak the local language of Tilathi Koiladi Rural Municipality, Saptari. Applying Procedures: Qualified candidates may send cover letter detailing their experience and motivation for the current position with an updated CV to nepalroym@gmail.com by 18th of February 2026. The application without cover letter and CV will not be considered for the position. Please write the name of Position you are applying for in the subject of email. Women and candidates from marginalized groups and respective Rural Municipality are encouraged to apply. Only the shortlisted candidates will be contacted and advance to written test and/or interview. No telephone calls will be entertained. Save to favorite Refer to a friend",Non-IT,Marketing,Social,Other,0.66,,2026-02-25T18:01:32
https://www.jobsnepal.com/english-teacher-grade-9-141298,jobsnepal,141298,https://www.jobsnepal.com/english-teacher-grade-9-141298,English Teacher - Grade 9,Kaasthamandap Vidhyalaya,https://www.jobsnepal.com/employer/kaasthamandap-vidhyalaya/7491,Kathmandu,,2026-02-12,,,Full Time,,Full Time,,,"Post Graduate / Masters in related field., M. Ed. (Education), Education, Teachers",Non-IT,Education,Other,Other,0.42,,2026-02-25T18:01:32
https://www.jobsnepal.com/terms-of-reference-to-conduct-a-study-on-effectiveness-of-wash-systems-strengthening-approach-in-madhesh-province-141299,jobsnepal,141299,https://www.jobsnepal.com/terms-of-reference-to-conduct-a-study-on-effectiveness-of-wash-systems-strengthening-approach-in-madhesh-province-141299,Terms of Reference To conduct a Study on effectiveness of WASH Systems Strengthening approach in Madhesh Province,Welthungerhilfe,https://www.jobsnepal.com/employer/welthungerhilfe/403116,Lalitpur,,2026-02-12,,,Contract,,Contract,,,"Development Project, Expression of Interests, Tender Notice, Bid",Non-IT,Legal,Other,Other,0.42,,2026-02-25T18:01:32
https://www.jobsnepal.com/monitoring-evaluation-accountability-and-learning-meal-specialist-141300,jobsnepal,141300,https://www.jobsnepal.com/monitoring-evaluation-accountability-and-learning-meal-specialist-141300,"Monitoring, Evaluation, Accountability and Learning (MEAL) Specialist",NGO Federation of Nepal,https://www.jobsnepal.com/employer/ngo-federation-of-nepal/412828,Kathmandu,,2026-02-12,,,Contract,,Contract,,,"Please check vacancy details, Social Science, Development Project, Development studies, Management",Non-IT,Finance,Accounting,Other,0.42,,2026-02-25T18:01:32
https://www.jobsnepal.com/research-and-development-officer-141301,jobsnepal,141301,https://www.jobsnepal.com/research-and-development-officer-141301,Research and Development Officer,Manavsewa Ashram,https://www.jobsnepal.com/employer/manavsewa-ashram/465461,Kathmandu,,2026-02-12,,,Contract,Senior Level,Contract,Based on experience,,"B.Devs. (Bachelors in Devlopment Studies), Bachelors in Psychology, Development studies, Management or related field, Bachelor's Degree in Humanities/Social Work/Education",Non-IT,Operations,Admin,Other,0.42,,2026-02-25T18:01:32
https://www.jobsnepal.com/expression-of-interest-eoi-call-for-consultancy-assignments-141302,jobsnepal,141302,https://www.jobsnepal.com/expression-of-interest-eoi-call-for-consultancy-assignments-141302,Expression of Interest (EOI) call for consultancy assignments,NGO Federation of Nepal,https://www.jobsnepal.com/employer/ngo-federation-of-nepal/412828,Kathmandu,,2026-02-12,,,Contract,,Contract,,,"Development Project, Expression of Interests, Tender Notice, Bid",Non-IT,Legal,Other,Other,0.42,,2026-02-25T18:01:32
https://www.jobsnepal.com/various-positions-141303,jobsnepal,141303,https://www.jobsnepal.com/various-positions-141303,Various Positions,FHI 360 Nepal,https://www.jobsnepal.com/employer/fhi-360-nepal/299,Kathmandu,,2026-02-16,,,Contract,,Contract,,,"Please check vacancy details, Public Health, Social Science, Development Project, Business Administration",Non-IT,Operations,Admin,Other,0.54,,2026-02-25T18:01:32
https://www.jobsnepal.com/request-for-proposal-rfp-for-consultancy-service-to-conduct-the-endline-survey-of-soar-education-project-bezos-ff-141304,jobsnepal,141304,https://www.jobsnepal.com/request-for-proposal-rfp-for-consultancy-service-to-conduct-the-endline-survey-of-soar-education-project-bezos-ff-141304,Request for Proposal (RFP) For Consultancy Service to conduct the endline survey of SOAR Education project (Bezos FF),CARE Nepal,https://www.jobsnepal.com/employer/care-nepal/381270,Lalitpur,,2026-02-13,,,Contract,,Contract,,,"Development Project, Expression of Interests, Tender Notice, Bid",Non-IT,Legal,Other,Other,0.42,,2026-02-25T18:01:32
